{
  "id": 770170,
  "name": "Sample Workato Recipe",
  "description": "Automated workflow for connecting enterprise applications.",
  "folder_id": 84,
  "source_type": "sample-source_type",
  "data_sources": [
    "sample-data_sources_item"
  ],
  "created_at": "2026-01-15T10:00:00Z",
  "updated_at": "2026-04-20T14:30:00Z"
}